<xs:schema xmlns:xs="http://www.w3.org/2001/XMLSchema" elementFormDefault="qualified">
	<xs:element name="NationalParks">
		<xs:complexType>
			<xs:sequence>
				<xs:element name="NationalPark" maxOccurs="unbounded">
					<xs:complexType>
						<xs:sequence>
							<xs:element name="Name" type="xs:string"/>
							<xs:element name="PhoneNumber" type="xs:string" minOccurs="1" maxOccurs="unbounded"/>
							<xs:element name="Address">
							<xs:complexType>
								<xs:sequence>
									<xs:element name="Number" type="xs:string"/>
									<xs:element name="Street" type="xs:string"/>
									<xs:element name="City" type="xs:string"/>
									<xs:element name="State" type ="xs:string"/>
									<xs:element name="Zip" type="xs:string"/>
								</xs:sequence>
								<xs:attribute name="NearestAirport" type="xs:string" use="required"/>
							</xs:complexType>
							</xs:element>	
						</xs:sequence>
						<xs:attribute name="Rating" type="xs:float" use="optional"/>
					</xs:complexType>
				</xs:element>
			</xs:sequence>
		</xs:complexType>	
	</xs:element>
</xs:schema>
